{
  "id": "youtube_script_basic",
  "version": "1.0.0",
  "nodes": [
    {
      "id": "define_the_target_audience_and_viewer_promise",
      "type": "schema",
      "label": "Define the target audience and viewer promise."
    },
    {
      "id": "write_a_one_sentence_premise",
      "type": "output",
      "label": "Write a one-sentence premise."
    },
    {
      "id": "outline_the_hook_context_main_beats_and_payoff",
      "type": "transform",
      "label": "Outline the hook, context, main beats, and payoff."
    },
    {
      "id": "mark_claims_that_need_sources_or_verification",
      "type": "transform",
      "label": "Mark claims that need sources or verification."
    },
    {
      "id": "draft_narration_in_a_spoken_style",
      "type": "transform",
      "label": "Draft narration in a spoken style."
    },
    {
      "id": "add_visual_notes_only_where_they_clarify_the_script",
      "type": "transform",
      "label": "Add visual notes only where they clarify the script."
    },
    {
      "id": "review_for_unsupported_claims_and_pacing_issues",
      "type": "transform",
      "label": "Review for unsupported claims and pacing issues."
    }
  ],
  "edges": [
    [
      "define_the_target_audience_and_viewer_promise",
      "write_a_one_sentence_premise"
    ],
    [
      "write_a_one_sentence_premise",
      "outline_the_hook_context_main_beats_and_payoff"
    ],
    [
      "outline_the_hook_context_main_beats_and_payoff",
      "mark_claims_that_need_sources_or_verification"
    ],
    [
      "mark_claims_that_need_sources_or_verification",
      "draft_narration_in_a_spoken_style"
    ],
    [
      "draft_narration_in_a_spoken_style",
      "add_visual_notes_only_where_they_clarify_the_script"
    ],
    [
      "add_visual_notes_only_where_they_clarify_the_script",
      "review_for_unsupported_claims_and_pacing_issues"
    ]
  ],
  "contracts": [
    {
      "name": "build_outline",
      "input": {
        "premise": "string",
        "audience": "string"
      },
      "output": {
        "outline": "list[dict]"
      }
    },
    {
      "name": "draft_script",
      "input": {
        "outline": "list[dict]"
      },
      "output": {
        "script": "string"
      }
    },
    {
      "name": "fact_check_claims",
      "input": {
        "script": "string"
      },
      "output": {
        "report": "dict"
      }
    }
  ],
  "failure_modes": [
    "Weak hook",
    "Unsupported factual claim",
    "Overlong intro",
    "Visual notes overwhelm narration"
  ],
  "verification": [
    "Premise is clear",
    "Claims are marked for review",
    "Intro reaches the point quickly",
    "Ending has a concise call to action"
  ]
}
